{"$defs":{"CausalDigest":{"pattern":"^[0-9a-f]{64}$","type":"string"},"ContentID":{"pattern":"^[0-9a-f]{64}$","type":"string"},"bounded_utf8_registry_string":{"maxLength":128,"minLength":1,"type":"string"},"bounded_utf8_registry_string_256":{"maxLength":256,"minLength":1,"type":"string"},"i128s":{"pattern":"^(0|-?[1-9][0-9]*)$","type":"string"},"rfc3339_full_date":{"pattern":"^[0-9]{4}-[0-9]{2}-[0-9]{2}$","type":"string"},"rfc3339_ns_utc":{"pattern":"^[0-9]{4}-[0-9]{2}-[0-9]{2}T[0-9]{2}:[0-9]{2}:[0-9]{2}\\.[0-9]{9}Z$","type":"string"},"safe_relative_path":{"pattern":"^(?![A-Za-z]:)(?!/)(?!\\.{1,2}(?:/|$))(?!.*(?:/\\.{1,2})(?:/|$))(?!.*//)[^/\\\\:\\x00]+(?:/[^/\\\\:\\x00]+)*$","type":"string"},"sha256":{"pattern":"^[0-9a-f]{64}$","type":"string"},"sq18s":{"pattern":"^(0|-?[1-9][0-9]*)$","type":"string"},"u64s":{"pattern":"^(0|[1-9][0-9]*)$","type":"string"},"uints":{"pattern":"^(0|[1-9][0-9]*)$","type":"string"},"uq18s":{"pattern":"^(0|[1-9][0-9]*)$","type":"string"}},"$id":"urn:build-finance:contract:simulated-order-intent:v1","$schema":"https://json-schema.org/draft/2020-12/schema","additionalProperties":false,"properties":{"action":{"enum":["OPEN_LONG","CLOSE_LONG"]},"base_decimals":{"maximum":18,"minimum":0,"type":"integer"},"base_mint":{"$ref":"#/$defs/bounded_utf8_registry_string"},"config_admission_receipt_id":{"$ref":"#/$defs/ContentID"},"created_replay_clock_ns":{"$ref":"#/$defs/u64s"},"decision_equal_time_group":{"$ref":"#/$defs/u64s"},"decision_ingest_sequence":{"$ref":"#/$defs/u64s"},"decision_sequence":{"$ref":"#/$defs/u64s"},"fill_policy":{"const":"STRICT_NEXT_EVENT"},"intent_id":{"$ref":"#/$defs/ContentID"},"intent_sequence":{"$ref":"#/$defs/u64s"},"market_id":{"$ref":"#/$defs/bounded_utf8_registry_string"},"max_impact_bps":{"maximum":2147483647,"minimum":0,"type":"integer"},"max_participation_bps":{"maximum":2147483647,"minimum":0,"type":"integer"},"portfolio_state_before_id":{"$ref":"#/$defs/ContentID"},"quantity_base_atoms":{"$ref":"#/$defs/u64s"},"quote_decimals":{"maximum":18,"minimum":0,"type":"integer"},"quote_mint":{"$ref":"#/$defs/bounded_utf8_registry_string"},"reference_price_q18":{"$ref":"#/$defs/sq18s"},"reservation_id":{"$ref":"#/$defs/ContentID"},"reserved_base_atoms":{"$ref":"#/$defs/u64s"},"reserved_quote_atoms":{"$ref":"#/$defs/u64s"},"risk_decision_id":{"$ref":"#/$defs/ContentID"},"schema":{"const":"trading.simulated-order-intent/v1"},"stop_price_q18":{"anyOf":[{"$ref":"#/$defs/sq18s"},{"type":"null"}]},"take_price_q18":{"anyOf":[{"$ref":"#/$defs/sq18s"},{"type":"null"}]},"time_in_force":{"const":"ONE_EVENT_GROUP"},"validated_config_sha256":{"$ref":"#/$defs/ContentID"}},"required":["schema","intent_id","intent_sequence","decision_sequence","risk_decision_id","config_admission_receipt_id","validated_config_sha256","portfolio_state_before_id","reservation_id","market_id","base_mint","quote_mint","base_decimals","quote_decimals","action","quantity_base_atoms","reference_price_q18","stop_price_q18","take_price_q18","max_participation_bps","max_impact_bps","reserved_quote_atoms","reserved_base_atoms","created_replay_clock_ns","decision_ingest_sequence","decision_equal_time_group","fill_policy","time_in_force"],"type":"object","x-contract-schema":"trading.simulated-order-intent/v1"}
