{
  "schema": "trading.simulated-order-intent/v1",
  "intent_id": "e22ceda9999b8dc8a4f67126968f52ffe375ff4ea4dfad9b3fbf2c59ac732448",
  "intent_sequence": "1",
  "decision_sequence": "1",
  "risk_decision_id": "7356690589b6862b233320b01cf3e49fe5d20facfb42ac17126b570441bb7f66",
  "config_admission_receipt_id": "bd92cef509e7a0f5804e1ce6559ab7276f6701b65bf17e042c8ab326a6fca4fe",
  "validated_config_sha256": "457cd0d75b6d9d86b967a4cce655960112c96cc57008feb09e6d9bd090af31d3",
  "portfolio_state_before_id": "cccccccccccccccccccccccccccccccccccccccccccccccccccccccccccccccc",
  "reservation_id": "aa45ab6ba9fc96f80424241163aaa1a43b6388500684063910381d57bdb6c6f6",
  "market_id": "fixture-base-mint/fixture-quote-mint:jupiter",
  "base_mint": "fixture-base-mint",
  "quote_mint": "fixture-quote-mint",
  "base_decimals": 9,
  "quote_decimals": 6,
  "action": "OPEN_LONG",
  "quantity_base_atoms": "100000000",
  "reference_price_q18": "1000000000000000000",
  "stop_price_q18": "950000000000000000",
  "take_price_q18": "1100000000000000000",
  "max_participation_bps": 500,
  "max_impact_bps": 50,
  "reserved_quote_atoms": "101000",
  "reserved_base_atoms": "0",
  "created_replay_clock_ns": "0",
  "decision_ingest_sequence": "1",
  "decision_equal_time_group": "1",
  "fill_policy": "STRICT_NEXT_EVENT",
  "time_in_force": "ONE_EVENT_GROUP"
}
